name,description,material_name
Corrosion,"After this creature Attacks, it afflicts the target with Blighted. If the target is already afflicted with Blighted, the target is healed for 100% of the amount of damage dealt.",Interloper Goo
Neon Grave,"After this creature Attacks, it has a 35% chance to Cast Affliction.",Invader Goo
Swell,"After this creature Attacks, it afflicts the target with a random debuff for each debuff the target already has.",Paralyzer Goo
Villainy Thrives,The potency of the enemies' Poisoned and Burning debuffs are shared with each otherf. This trait does not stack.,Plaguespreader Goo
Intensify,"After this creature Attacks, it increases the potency of the target's Poisoned and Burning debuffs by 50%.",Skirmisher Goo
Viscous Webs,Enemies take 25% more damage for each debuff they have that they're resistant to. This trait does not stack.,Webweaver Goo
Master of Mites,Your Mites have a 5% chance to avoid damage for each Mite fighting on your side. This trait does not stack.,Sigil of the Mite
No Sanctuary,"The damage of this creature's attacks and the potency of this creature's spells is based on its Speed, rather than its Attack or Intelligence.",Mogwai's Sanctuary
Inner Hatred,Your creatures have 100% more Attack. This trait is ignored when your creatures Attack. This trait does not stack.,Creep Wrappings
Exploitation,Your creatures have 20% more Attack and Intelligence for each enemy that is afflicted with Cursed. This trait does not stack.,Doom Wrappings
Gimp Touch,This creature's attacks deal 75% more damage and afflict Cursed.,Gimp Wrappings
Pharaoh's Beckoning,"After this creature Attacks, the target is forced to attack this creature 3 times. These attacks deal 25% normal damage.",Lord Wrappings
Mockery,Your creatures take 30% less damage (up to 90%) from spells for each enemy that is afflicted with Cursed. This trait does not stack.,Nightmare Wrappings
Curse of the Outspoken,"After an enemy Casts a spell, this creature afflicts it with Cursed and Vulnerable.",Scourge Wrappings
Sorrow,Enemies with Cursed take 50% more damage from this debuff.,Swarm Wrappings
Master of Mummies,"After your Mummies take damage while it is thier turn, they recover Health equal to 100% of the damage taken. This trait does not stack.",Sigil of the Mummy
Ambush,"At the start of this creature's turn, it attacks the closest enemy below it on the Timeline.",Backstabber Mask
Break Down And Cry,"Before this creature dies, it Casts 3 of its spells.",Creeper Mask
Subtlety,"Your creatures deal 50% less damage while it's their turn, and 100% more damage when it's not. This trait does not stack.",Exile Mask
Heartseeker,This creature attacks 1 additional time. The amount of damage each of this creature's extra attacks deal after the first is increased by 35% of the damage the first attack dealt.,Guardian Mask
Starless,Creatures cannot gain stats.,Imposter Mask
Supersonic,"At the start of battle, enemies are afflicted with Silenced for 1 turn.",Informer Mask
Reroute to Remain,"At the start of battle, enemies are afflicted with Scorned for 1 turn.",Scoundrel Mask
Pacing Death's Trail,"After an ally dies, this creature Attacks 4 random enemies.",Shadowjumper Mask
Master of Nixes,"If all the creatures in your party are Nixes, they start battles with Inivisible and have a 25% chance to avoid damage. This trait does not stack.",Sigil of the Nix
Lingering Incantation,"After your creatures Cast a Sorcery spell, this creature afflicts 3 random enemies with a random debuff. This trait does not stack.",Celestial Orb
Strength of the Mind,Your creatures' Intelligence cannot be reduced.,Delusion Orb
Seal Magic,"After an enemy Casts a spell, that Spell Gem is Sealed.",Disciple Orb
Conjuration,"After this creature Casts a Sorcery spell, your other creatures' Sorcery Spell Gems gain 1 Charge. This trait does not stack.",Mirage Orb
Thaumaturgy,Your creatures have 7% more Intelligence for each non-Ethereal Sorcery Spell Gem each of your creatures have equipped. Maximum of 3 Spell Gems per creature. This trait does not stack.,Raptor Orb
Phantasm,Your creatures' Spell Gems deal 30% more damage for each time they've been Cast in the current battle. This trait does not stack.,Spellbinder Orb
Apprenticeship,"After your other creatures manually Cast a spell, this creature Casts Magic Missile on a random enemy.",Spider Orb
Viper's Mind,"At the start of this creature's turn, it gains Intelligence equal to 50% of its Speed.",Viper Orb
Arcane Brilliance,"After your creatures Cast a Sorcery spell, they gain 40% Intelligence. This trait does not stack.",Zealot Orb
Sarea's Command,"At the start of battle, each enemy Attacks a random enemy. This trait does not stack.",Sarea's Broken Heart
Sarea's Haste,"Buffs and debuffs last twice as long, but they lose 2 units of duration per turn. This trait does not stack.",Sarea's Brittle Hair
Sarea's Plot,Your creatures deal 15% more damage for each time they've been damaged by attacks or spells in the current battle. This trait does not stack.,Sarea's Flayed Skin
Master of Occultists,"If all the creatures in your party are Occultists, their spells consume no Charges and Cast 1 additional time. This trait does not stack.",Sigil of the Occultist
Infusion,Your creatures Cast Life spells as if they have 100% more Intelligence. This trait does not stack.,Burhua Eyeball
Twist of Fate,"After your creatures manually Cast a Life spell, they gain a random buff.",Enim Eyeball
Spectrum of Eternity,"After your creatures manually Cast a Life spell, they have a 50% chance to take another turn. This trait does not stack.",Geylian Eyeball
Solace,"At the start of battle, your creatures gain 10% Health for each non-Ethereal Life Spell Gem each of your creatures have equipped. Maximum of 3 Spell Gems per creature. This trait does not stack.",Irantha Eyeball
Worship,"After your creatures manually Cast a Life spell, they gain a random trait. This trait does not stack.",Maluh Eyeball
Center of the Universe,"At the start of battle, your creatures share copies of their non-Ethereal Life Spell Gems (maximum of 5) with each other. This trait does not stack.",Mitida Eyeball
Mantra,"At the start of battle, your creatures gain Major Healing. This spell has 100% more potency.",Narklin Eyeball
Nerlyx's Chant,"After your creatures Defend, they gain a random buff. This trait does not stack.",Nerlyx's Gorged Vein
Nerlyx's Disturbance,Your creatures take 10% less damage for each time they've Defended in the current battle. Maximum of 90% damage reduction. This trait does not stack.,Nerlyx's Closed Eye
Nerlyx's Veil,"After your creatures Defend, they have a 50% chance to take another turn. This trait does not stack.",Nerlyx's Damaged Cornea
Master of Ophans,"After your Ophans Cast a Life spell, all your Ophans recover 25% Health.",Sigil of the Ophan
Lonesome Haze,"After your creatures are resurrected, they Attack random enemies 3 times.",Unfinished Fossil
Introvert,"After your creatures are resurrected, they have a 35% chance to gain Rebirth. This trait does not stack.",Bloody Fossil
Solitary Empowerment,"At the start of battle, 3 of your creatures gain Rebirth.",Defender Fossil
Forbearance,"When your creatures are resurrected, they are resurrected with 100% additional Health. If this amount exceeds their Maximum Health, their Maximum Health increases by an amount equal to the difference. This trait does not stack.",Shadow Fossil
Asceticism,"After your creatures are resurrected by Rebirth, they gain Mending, Repelling, and Shelled.",Igneous Fossil
Reclusive Glutton,"After your creatures are resurrected, they Cast 5 random spells. This trait does not stack.",Scourge Fossil
Giran's Rigor,This creature cannot lose stats.,Giran's Eye
Giran's Strategy,"At the start of battle, this creature's Health, Attack, Intelligence, Defense, and Speed are set equal to those of the second, third, fourth, fifth, and sixth creature in your party.",Giran's Skull
Giran's Unity,This creature has additional stats equal to 10% of your other creatures' stats.,Giran's Kneecap
Master of Osseins,"If all the creatures in your party are Osseins, they start battles with Rebirth. In addition, they are resurrected by this buff with 100% Health.",Sigil of the Ossein
Amethyst Attunement,All creatures' Ethereal Spell Gems are created with only 1 Charge.,Giant Amethyst
Bismuth Attunement,Creatures gain 50% less stats. This trait does not stack.,Bismuth Jewel
Chocolate Attunement,Creatures cannot gain buffs.,Chocolate Egg
Diamond Attunement,All Spell Gems are 50% more potent. This trait does not stack.,Giant Diamond
Emerald Attunement,All creatures deal 50% more damage. This trait does not stack.,Giant Emerald
Opal Attunement,Creatures cannot lose stats.,Giant Opal
Ruby Attunement,All creatures have 75% more Health. This trait does not stack.,Giant Ruby
Sapphire Attunement,All creatures take 50% less damage. This trait does not stack.,Giant Sapphire
Topaz Attunement,All buffs and debuffs last for only 1 turn.,Giant Topaz
Chroma's Shelter,This creature is immune to damage from its own class.,Chroma's Bent Crown
Chroma's Solution,"While this creature has Scorned, it has 100% more Intelligence. While this creature has Silenced, it has 100% more Attack.",Chroma's Emblem
Chroma's Stability,"While this creature has Scorned, it is immune to damage from attacks. While this creature has Silenced, it is immune to damage from spells.",Chroma's Tarnished Jewel
Master of Paragons,Your Paragons take 80% less damage from spells. This trait does not stack.,Sigil of the Paragon
Resilience Aura,"After an enemy dies, your creatures are resurrected with 50% Health.",Champion Prism
Might Aura,Your creatures deal 25% more damage. This trait does not stack.,Executioner Prism
Endurance Aura,Your creatures take 70% less damage from all sources other than attacks and spells. This trait does not stack.,Knight Prism
Agility Aura,Your creatures have a 40% greater chance to dodge attacks. This trait does not stack.,Marauder Prism
Shield Aura,"After your creatures take damage from an attack or spell, they have a 35% chance to gain Shelled. This trait does not stack.",Paladin Prism
Dexterity Aura,Your creatures have an independent 20% chance to deal critical damage and dodge attacks. This trait does not stack.,Rogue Prism
Shock Aura,"After your creatures are Attacked, the attacker takes damage equal to 25% of the attacker's Speed. This trait does not stack.",Spellblade Prism
Master of Phase Warriors,"If all the creatures in your party are Phase Warriors, they are immune to indirect damage.",Sigil of the Phase Warrior
Lifebinder,"After your creatures kill an ally, your creatures are resurrected with 50% Health.",Ancestral Plume
Final Breath,"After an enemy is resurrected, it has a 75% chance to be killed again.",Corrupted Plume
Terminus,"At the start of this creature's turn, it is killed. Then, it is resurrected with 100% Health.",Divine Plume
Breath of the Dying,"After your creatures are resurrected, 3 enemies are afflicted with Frozen.",Frost Plume
Second Chance,"When your creatures are resurrected, they have a 50% chance to be placed at the top of the Timeline. This trait does not stack.",Royal Plume
Thundershock,"After your creatures are resurrected, 3 enemies are afflicted with Stone.",Thunderstruck Plume
Alternate Reality,Your other creatures take 60% less damage while this creature is alive. Your other creatures take 40% more damage while this creature is dead. This trait does not stack.,Transcended Plume
Buffet,"After your creatures are resurrected, enemies take damage equal to 50% of this creature's Speed.",Volatile Plume
Master of Phoenixes,"At the start of your Phoenixes' turns, their on-resurrect effects have a 50% chance to activate. This trait does not stack.",Sigil of the Phoenix
Brain Drain,"After an enemy takes damage from Bleeding, they lose 15% of their Intelligence, and your creatures gain that Intelligence. This trait does not stack.",Arcane Sickle
Shadow Hook,"Your creatures deal 10% more damage, and enemies deal 10% less damage, for each enemy that is afflicted with Bleeding. This trait does not stack.",Darkscythe Sickle
Kindling,"After an enemy is afflicted with Bleeding or Burning, this creature afflicts them with whichever of these debuffs the target doesn't already have.",Flamehook Sickle
Bleed Out,"After an enemy takes damage from Bleeding, your creatures recover Health equal to 50% of the damage dealt. This trait does not stack.",Guardian Sickle
Spatter,"After an enemy with Bleeding dies, this creature deals damage to all enemies equal to 20% of the dead creature's Maximum Health.",Harvester Sickle
Throat Slash,Enemies start battles with Bleeding.,Herbalist Sickle
Flay,This creature's attacks deal 75% more damage and afflict Bleeding.,Peasant Sickle
Marked For Death,"After this creature Provokes, it Attacks each enemy that is afflicted with Bleeding for 50% normal damage.",Slasher Sickle
Pica,"Your creatures have 7% more Attack and Intelligence for each resource-yielding object you've collected in the current Realm, up to a maximum of 15. If you're not in a Realm, this trait acts as if you've collected 10 objects. This trait does not stack.",Steampowered Sickle
Zenpang's Boast,Your creatures take 10% less damage for each time they've Provoked in the current battle. Maximum of 90% damage reduction. This trait does not stack.,Zenpang's Feather
Zenpang's Exploit,Enemies take 100% more damage while Provoking. This trait does not stack.,Zenpang's Bounty
Zenpang's Yell,"After your creatures Provoke, they gain a random buff. This trait does not stack.",Zenpang's Bent Scythe
Master of Pilwizes,"If all the creatures in your party are Pilwizes, enemies' Bleeding damage is based on their highest stat. This trait does not stack.",Sigil of the Pilwiz
Haunted Carapace,"At the start of each ally's turn, this creature deals damage to a random enemy equal to 15% of the ally's Intelligence.",Accursed Acid
Insatiable,"At the end of each ally's turn, this creature gains Attack equal to 7% of the ally's Attack.",Gladiator Acid
Hindrance,"At the start of each enemy's turn, this creature decreases their Speed by 20%.",Harbinger Acid
Rock Candy,"At the start of each enemy's turn, this creature Seals one of their Spell Gems.",Lurking Acid
Elusiveness,Your creatures that have taken at least 3 turns are resistant to debuffs.,Marine Acid
Spew Acid,"At the end of each enemy's turn, this creature decreases their Defense by 15%.",Spitting Acid
Live to Labor,"At the start of each enemy's turn, this creature deals damage to them equal to 20% of its Attack.",Tunneler Acid
Death's Bite,"At the end of each ally's turn, this creature Attacks a random enemy for 30% normal damage.",Vicious Acid
Ceaseless Fighting,"When your creatures are killed, they attack a random enemy.",Ceaseless Fang
Ceaseless Flame,"When an enemy takes damage from Burning, it has a 50% chance to take this damage a second time. This effect can repeat multiple times in a row.",Ceaseless Spit
Ceaseless Vitality,"At the start of this creature's turn, it recovers 20% Health and gains Shelled.",Ceaseless Heart
Master of Pit Worms,"If all the creatues in your party are Pit Worms, their innate tratis activate an additional time. This trait does not stack.",Sigil of the Pit Worm
Decrepify,"After this creature Attacks, it decreases the target's Defense by 50%.",Dominator Ganglion
Breaker,Your creatures deal 100% more damage to targets that are Defending or Provoking. This trait does not stack.,Liberator Ganglion
Through the Gloom,Your creatures deal 50% more damage to targets that are above 90% Health. This trait does not stack.,Lord Ganglion
Unmending,Enemies take 0.5% more damage for every 1% Health they have. This trait does not stack.,Obliterator Ganglion
Soul Squelch,"After this creature Attacks, it reduces the target's Maximum Health to its Current Health.",Overmind Ganglion
Stricken,"At the start of battle, afflict each enemy with 2 random debuffs. This trait does not stack.",Redeemer Ganglion
Haunting Memories,"At the end of each enemy's turn, this creature has a 50% chance to Attack it if this creature is dead.",Tormenter Ganglion
Master of Pit Wraiths,"If all the creatures in your party are Pit Wraiths, they are resistant to debuffs.",Sigil of the Pit Wraith
Drained,"After an enemy loses stats, this creature deals damage to that enemy equal to 50% of the amount of stats lost.",Alchemist Scalpel
Kismet,"After an enemy afflicts your creatures with a debuff, this creature afflicts the enemy with that debuff as well.",Expert Scalpel
Maximize,"After this creature Attacks, it converts each of the target's buffs into random debuffs.",Herbalist Scalpel
Blood and Power,Your creatures deal additional damage with attacks equal to 10% of the healing they've received in the current battle. This trait does not stack.,Phlebotomist Scalpel
Black to White,"After an enemy's debuff wears off, it is afflicted with a random debuff. This trait does not stack.",Quack Scalpel
Insipid,"Your creatures take 15% less damage for each debuff they have, up to a maximum of 75%. This trait does not stack.",Scholar Scalpel
Metaphor,"After an enemy takes damage from Poisoned, Burning, or Blighted, your creatures recover Health equal to 35% of the damage dealt. This trait does not stack.",Soothsayer Scalpel
Liberation,This creature Casts spells 1 additional time for each minion it has.,Surgeon Scalpel
Master of Plague Doctors,"If all the creatures in your party are Plague Doctors, they gain the Drained trait at the start of battle.",Sigil of the Plague Doctor
Tender of Earth,"At the start of this creature's turn, your other creatures gain a random Spell Gem that belongs to their class.",Desert Rod
Shepherd of Fire,"At the start of this creature's turn, it increases your other creatures' Attack by 15% of this creature's Attack.",Fire Rod
Zealot of the Forest,"At the start of this creature's turn, it increases your other creatures' Speed by 15% of this creature's Speed.",Forest Rod
Preacher of Stone,"At the start of this creature's turn, it increases your other creatures' Defense by 15% of this creature's Defense.",Mountain Rod
Bearer of Needs,"At the start of this creature's turn, it heals your other creatures equal to 15% of its Maximum Health.",Light Rod
Radiant Eclipse,"At the start of this creature's turn, it grants your creatures a Barrier that absorbs damage equal to 15% of its Maximum Health.",Radiance Rod
Fanaticism,"At the start of this creature's turn, it grants your creatures 1 random buff.",Vizier Rod
Disciple of War,"At the start of this creature's turn, it removes 2 debuffs from your other creatures.",War Rod
Apostle of Water,"At the start of this creature's turn, it increases your other creatures' Intelligence by 15% of this creature's Intelligence.",Water Rod
Master of Priests,"If all the creatures in your party belong to the Priest race, their innate traits activate an additional time. This trait does not stack.",Sigil of the Priest
Memoriae,Your creatures have a 75% chance to maintain their Invisible buff after they act. This trait does not stack.,Purrghast's Emblem
Evocation,Your creatures have 35% more Intelligence. This trait does not stack.,Acolyte Claw
Swiftcasting,"When your creatures Cast a spell, 35% of their Speed is added to their Intelligence to determine the potency of the spell. This trait does not stack.",Batmaster Claw
Blood Magic,"At the start of this creature's turn, it takes damage equal to 20% of its Maximum Health and converts 200% of it into Intelligence.",Bloodmage Claw
Everything's Gone,Enemies start battles with 80% Health.,Defiler Claw
Mindful Awareness,"After your creatures are Attacked, 35% of their Intelligence is added to their Defense when determining the damage taken. This trait does not stack.",Guardian Claw
Alteration,Your creatures' spells deal 50% of their damage using Speed instead of Intelligence. This trait does not stack.,Lord Claw
Psychic Barrier,"At the start of this creature's turn, it gains Defense equal to 50% of its Intelligence.",Ritualist Claw
Farsight,"After your creatures gain a buff, they Cast a random spell. This trait can only activate once per turn. This trait does not stack.",Seer Claw
Master of Ravens,Your Ravens have 15% more Intelligence and Speed for each Raven fighting on your side. This trait does not stack.,Sigil of the Raven
Decapitation,"After this creature Attacks a creature with less than 35% Health, it is killed, and your creatures recover 200% Health.",Blood Scythe
Bonecraft,"After this creature Attacks an ally with less than 35% Health, it is killed, then this creature grants 50% of its Attack, Intelligence, and Defense to all your other creatures.",Bone Scythe
Soul Corruption,"After this creature Attacks a creature with less than 35% Health, it is killed, then this creature afflicts enemies with a random debuff for each buff the target had before it died.",Cursed Scythe
Defy the Gods,"After this creature Attacks an ally with less than 50% Health, it is killed, then this creature resurrects it with 100% Health and 50% more Attack, Intelligence, and Speed.",Incursion Scythe
Assumption,"After this creature Attacks a creature with less than 35% Health, it is killed, then this creature Casts its first 3 spells.",Plague Scythe
Shadow Scythe,"After this creature Attacks an enemy with less than 35% Health, it is killed, then this creature deals damage to adjacent enemies equal to 200% of the damage dealt by the Attack.",Shadow Scythe
Soul Siphon,"After this creature Attacks a creature with less than 35% Health, it is killed, then this creature gives a copy of its trait to all your creatures.",Soul Scythe
Heart Versus Cog,"After your creatures' Barrier buffs are damaged and destroyed, they gain 50% of the original strength of the Barrier as Maximum Health. This trait does not stack.",Tech Scythe
Master of Reapers,Your Reapers' traits now activate at 50% Health.,Sigil of the Reaper
Fireworks,"After this creature manually Casts a spell, it deals damage to enemies equal to 40% of its Speed.",Ascendant Lantern
Pain Redefined,"After this creature Defends, it takes damage equal to 20% of its Maximum Health and grants 1 random buff to all your creatures.",Cabalist Fin
Reign of Pain,This creature deals 5% more damage for every 1% Health it is missing.,Captain Fin
Lunacy,"Enemies take 40% more damage, but are immune to debuffs. This trait does not stack.",Dagon Fin
Delirium,"After this creature takes damage, it gains Intelligence equal to 40% of the damage it took.",Horror Fin
Pact of the Deep,"At the start of battle, this creature steals 35% of your other creatures' Health.",King Fin
Internal Struggle,"After this creature Casts a spell, it loses 25% Current Health, adds this amount of Health to its damage, and Casts the spell 1 additional time.",Sealord Fin
Blood For Blood,"When this creature Attacks, it loses 20% Current Health and adds 200% of this amount to the damage dealt.",Soldier Fin
Gift of Scylla,"After your creatures die, they grant 25% of their Attack and Speed to all your creatures. This trait does not stack.",Scylla's Plume
Master of Revenants,"If all the creatures in your party are Revenants, they recover 50% Health at the end of their turns. This trait does not stack.",Sigil of the Revenant
Psychic Dance,All effects that activate when a creature dodges will activate 1 additional time. This trait does not stack.,Aen Silk
Moon Dance,All effects that activate when a creature Provokes will activate 1 additional time. This trait does not stack.,Aerum Silk
Renaissance,All effects that activate when a creature resurrects will activate 1 additional time. This trait does not stack.,Apollinaire Silk
Fan Dance,All effects that activate when a creature Defends will activate 1 additional time. This trait does not stack.,Inaer Silk
Dark Dance,All effects that activate when a creature dies will activate 1 additional time. This trait does not stack.,Nadin Silk
What Is Left,This creature deals additional damage with attacks and spells equal to 1% of the stats it has gained in the current battle.,Nax Silk
Sword Dance,All effects that activate when a creature deals critical damage will activate 1 additional time. This trait does not stack.,Ramun Silk
Master of Rift Dancers,"If all the creatures in your party belong to the Rift Dancer race, their innate traits activate 1 additional time. This trait does not stack.",Sigil of the Rift Dancer
Hotspur,"At the start of battle, your creatures each have a 50% chance to Cast one of their spells at random. This trait does not stack.",Chaos Oil
Memorial,"After your creatures are resurrected, they Cast one of their spells at random. This trait does not stack.",Earth Oil
Until the End,"Before your other creatures die, they Cast one of their spells at random. This trait does not stack.",Fire Oil
Naivety,"When your creatures take damage that exceeds 15% of their Maximum Health, they Cast one of their spells at random. This trait can only activate once per turn for each creature. This trait does not stack.",Ice Oil
Limitless,"When your creatures Cast a spell, they have a 50% chance to Cast it 1 additional time. This trait does not stack.",Thunder Oil
Wallflower,"After your creatures Defend or Provoke, they Cast one of their spells at random. This trait does not stack.",Water Oil
Simulation,"When your creatures Cast a spell due to a Salamander trait, they Cast another one of their spells at random. This trait does not stack.",Wind Oil
Master of Salamanders,"If all the creatures in your party are Salamanders, their spells are 60% more potent. This trait does not stack.",Sigil of the Salamander
