name,description,material_name
Frailty,"When this creature Attacks an enemy with Vulnerable, it deals 100% more damage, recovers Health equal to 100% of the damage dealt, and removes this debuff.",Bile Stitches
Flesh Rot,"After an enemy is afflicted with either Weak or Vulnerable, this creature afflicts them with whichever of these debuffs the target doesn't already have.",Brute Stitches
Extra Padding,"At the start of battle, this creature gains a Barrier that absorbs damage equal to 200% of its highest stat.",N/A
Wretchedness,Your creatures' attacks against enemy creatures with Vulnerable cannot be Dodged and have a 50% greater chance to deal critical damage. This trait does not stack.,Flesh Stitches
Manipulate Fear,Enemy creatures with Weak have 50% less Attack and cannot deal critical damage. This trait does not stack.,Gore Stitches
Turn to Gray,"After this creature is Attacked, enemies are afflicted with Vulnerable.",Ritual Stitches
Quell,"When this creature Attacks an enemy with Vulnerable, it deals 100% more damage. If this damage exceeds 35% of the target's Current Health, the target dies.",Volatile Stitches
Sin and Sentence,"After this creature Attacks an enemy with both Weak and Vulnerable, it has a 50% chance to kill the target.",Wandering Stitches
Master of Abominations,"If all the creatures in your party are Abominations, enemies always have Weak and Vulnerable, and take 50% more damage. This trait does not stack.",Sigil of the Abomination
Slosh,"After your creatures manually Cast a spell, a random enemy is afflicted with a random debuff. This trait does not stack.",Bottle of Grenale
Drinking Game,"At the start of each enemy's turn, they have a 5% chance to be killed. This trait does not stack.",Bottle of Lagergoyle
Alcoholism,"After an enemy is afflicted with a debuff, they have a 10% chance to be sent to the bottom of the Timeline. This trait does not stack.",Bottle of Ryetrap
Drunken Rage,"At the start of each enemy's turn, they have a 5% chance to attack one of their allies for each debuff they have. This trait does not stack.",Bottle of Scotchpion
Numbed Pain,"When your creatures would take damage from an attack or spell, they have a 5% chance to take 0 damage for each debuff they have. This trait does not stack.",Bottle of Spirits
False Epiphany,Enemies' spells cost 1 more Charge for every 2 debuffs they have. This trait does not stack.,Bottle of Vermowl
Bob and Weave,Your creatures have an independent 25% chance to dodge for each buff the enemy has. This trait does not stack.,Bottle of Vulperry
Hangover,"At the start of each enemy's turn, this creature has a 35% chance to Cast a random Booze Spell. This trait does not stack.",Bottle of Whiskull
Hangover Cure,"After your creatures heal an enemy, it has a 3% chance to be killed for each debuff it has. This trait does not stack.",Bottle of Winegel
Drunken Brawler,"After your creatures Dodge an attack, they counter-attack for 40% normal damage. This trait does not stack.",Bottle of Woodka
Master of Alementals,"At the start of battle, your Alementals gains 2 random Booze Spells for each Alemental fighting on your side. This trait does not stack.",Sigil of the Alemental
Incandescence,"At the start of battle, this creature gains Maximum Health equal to 100% of its Defense.",Amaranthine Splinters
Memento Mori,"After this creature is Attacked, the enemy takes damage equal to 75% of this creature's Defense.",Enclave Splinters
Soulstone Splinter,"After your creatures are Attacked, they gain 20% Defense. This trait does not stack.",Unguided Splinters
Collective Unconscious,"After your creatures gain Defense, they gain an equal amount of Attack. This trait does not stack.",Nexus Splinters
Jailbreak,Your creatures have 40% more Defense. This trait does not stack.,Planetary Splinters
Crystallization,"After this creature Casts a spell, your creatures gain 15% Defense.",Radiant Splinters
Solar Flare,"After this creature is Attacked while it is Defending or Provoking, it Casts Stellar Flare.",Solar Drink
Exalted Detriment,Your creatures deal additional damage with attacks equal to 30% of their Defense. This trait does not stack.,Stardust Splinters
Master of Amaranths,"At the start of battle, your Amaranths share 15% of their Defense with each other. This trait does not stack.",Sigil of the Amaranth
Multistrike,"Your creatures Attack 1 additional time, but all their attacks deal 30% less damage. This trait does not stack.",Attorney Cord
Multicast,"Your creatures Cast spells 1 additional time, but their spells are 30% less potent. This trait does not stack.",Chef Cord
Unrealized Potential,"After your creatures gain stats, they gain these stats an additional time, but they gain 50% fewer stats. This trait does not stack.",Horticulturist Cord
Unbidden Miracle,"After your creatures are healed, they are healed an additional time, but they receive 50% less healing from all sources. This trait does not stack.",Inspector Cord
Careful What You Wish For,"After your creatures gain a buff, they gain an additional random buff, but their buffs only last for 1 turn. This trait does not stack.",Prospector Cord
Grim Ailment,"After your creatures apply a debuff, they apply an additional random debuff, but their debuffs only last for 1 turn. This trait does not stack.",Vaccinator Cord
Master of Amphisbaena,"If all the creatures in your party are Amphisbaenas, their innate traits' repsective effects activate 1 additional time. This trait does not stack.",Sigil of the Amphisbaena
Hand of Light,This creature's attacks deal 75% more damage and grant this creature Shelled.,Aegis Claymore
Scourge,This creature's attacks deal 75% more damage and afflict the target with Weak.,Doomblight Claymore
Pyre,This creature's attacks deal 75% more damage and afflict the target with Burning.,Firewound Claymore
Stasis,This creature's attacks deal 75% more damage and afflict the target with Confused.,Goldblight Claymore
Rime,This creature's attacks deal 75% more damage and afflict the target with Frozen.,Icewound Claymore
Black Hole Halo,This creature's attacks deal 75% more damage and afflict the target with Scorned.,Imperial Claymore
Soul to Keep,"This creature's attacks deal 75% more damage. After this creature Attacks, it gains a copy of the target's trait.",Soulslayer Claymore
Storm of the Century,"After this creature Attacks, it Casts Lightning Storm.",Thunderwound Claymore
Final Act of Hatred,"When one of your creatures dies, each of their non-Ethereal Spell Gems has a 20% chance to be Cast.",Claymore of Hatred
Final Act of Judgement,"At the start of this creature's turn, it deals damage to enemies equal to 1% of their Current Health for every 0.5% of Health this creature is missing.
The damage cannot exceed 35% of each creatures' Current Health.",Claymore of Judgment
Final Act of Mercy,"At the start of this creature's turn, it kills all enemies that are below 25% Health.",Claymore of Mercy
Master of Angels,Your Angels' attacks apply all the debuffs that your other Angels' innate traits apply as well.,Sigil of the Angel
Brilliant Creation,"This creature has 15% more Attack and Intelligence for each dead creature on your side, and 15% more Defense and Speed for each living creature on your side.",N/A
Primed And Ready,"After an enemy Casts a spell on all your creatures, this creature Attacks it for 300% normal damage.",Adolescent Egg
Threshold,"After this creature Attacks, it afflicts the target with Scorned and Disarmed.",Charger Headdress
Vigilance,This creature intercepts attacks on its allies.,Defender Headdress
Long Live,This creature takes 2% less damage from attacks (up to 90%) for every 1% Health it is missing.,Endurer Headdress
Grit,"At the start of battle, this creature's Attack is added to its Health and Defense, then its Attack is set to its minimum value.",Guardian Headdress
Necessitarianism,"At the start of battle, this creature gains 100% Attack, Intelligence, Defense, and Speed. This creature deals 70% less damage.",Majesty Headdress
Righteous Concession,This creature and the creatures adjacent to it are resistant to debuffs.,Protector Headdress
Crunch,This creature's attacks deal 75% more damage and afflict the target with Vulnerable.,Warrior Headdress
Master of Apises,"At the start of battle, your Apises gain the Long Live trait.",Sigil of the Apis
Urh Harbinger,"Your creatures have 15% more Attack, Intelligence, Defense, and Speed for each turn they've taken in the current battle. This trait does not stack.",Aaxer Sinew
Urdox Harbinger,Your creatures deal 50% more critical damage for each turn they've taken in the current battle. This trait does not stack.,Agor Sinew
Culmination,Your creatures' spells deal 5% more damage for each spell all your creatures have manually Cast in the current battle. This trait does not stack.,Corox Sinew
Quahn Harbinger,Your creatures have a 25% chance to resist debuffs for each turn they've taken in the current battle. This trait does not stack.,Gorum Sinew
Naxor Harbinger,Your creatures deal 40% more damage for each turn they've taken in the current battle. This trait does not stack.,Inox Sinew
Mungus Harbinger,Your creatures take 10% less damage for each turn they've taken in the current battle. Maximum of 90% damage reduction. This trait does not stack.,Zarox Sinew
Phase Out,Your creatures have a 5% chance (up to 50%) to avoid damage for each turn they've taken in the current battle. This trait does not stack.,Zzyia Sinew
Gift of Charybdis,"After your creatures die, they grant 25% of their Intelligence and Defense to all your creatures. This trait does not stack.",Charybdis' Trident
Torn Between Scylla and Charybdis,"When your creatures die, they grant a copy of their innate trait to your other creatures.",Cloud Opal
Master of Apocalypses,Your Apocalypses act as if they take 2 turns at once. This trait does not stack.,Sigil of the Apocalypse
Consume,"When this creature Attacks an enemy with Snared, it deals 150% more damage, recovers Health equal to 100% of the damage dealt, and removes this debuff.",Ancient Mandible
Here to Die,"After an enemy is afflicted with either Bleeding or Poisoned, this creature afflicts them with whichever of these debuffs the target doesn't already have.",Canopy Mandible
Hopelessness,Enemies with Snared take 50% more damage. This trait does not stack.,Creeping Mandible
Numbing Venom,"After an enemy takes damage from Poisoned, they have a 50% chance to be afflicted with Snared. This trait does not stack.",Dragonlair Mandible
Entrapment,"After this creature is Attacked, it afflicts the enemy with Snared.",Goliath Mandible
Jagged Edges,"At the start of each creature's turn, enemies with Snared take damage equal to 10% of this creature's Speed. This trait does not stack.",Razorweb Mandible
Spit Poison,"After this creature is Attacked, it afflicts enemies with Poisoned. If enemies already have this debuff, its potency is increased by 30% instead.",Spitting Mandible
Arachnophobia,Enemies with Snared take 65% more damage from their Poison debuff. This trait does not stack.,Wooly Mandible
Master of Arachnalisks,Enemies take 20% more damage from Poisoned for each Arachnalisk fighting on your side. This trait does not stack.,Sigil of the Arachnalisk
Call of the Harvest,"Your creatures always have Agile. In addition, this creature has an independent 50% chance to dodge attacks.",Autumn Figment
Call of Evolution,"After this creature dodges an attack, it Casts one of its spells. In addition, this creature has an independent 50% chance to dodge attacks.",Change Figment
Call of the Grave,"After this creature dodges, enemies lose 20% of their highest stat. In addition, this creature has an independent 50% chance to dodge attacks. This trait does not stack.",Decay Figment
Call of the Aspect,"This creature has an independent 12% chance to dodge attacks for each different type of Aspect fighting on your side. When it does, your Aspects gain 20% Attack, Intelligence, Defense, and Speed.",Seasons Figment
Call of the Bloom,"After this creature dodges, your creatures recover 30% Health. In addition, this creature has an independent 50% chance to dodge attacks.",Springtime Figment
Call of the Solstice,"After this creature dodges, it attacks the enemy. In addition, this creature has an independent 50% chance to dodge attacks.",Summer Figment
Call of Time,"After this creature dodges an attack, it gains a Barrier that absorbs damage equal to 50% of its Speed. In addition, this creature has an independent 50% chance to dodge attacks.",Time Figment
Call of the Tundra,"After this creature dodges, it Casts Snowstorm. In addition, this creature has an independent 50% chance to dodge attacks.",Winter Figment
Crown Prince Syndrome,"After this creature dodges or deals critical damage, it Defends or Provokes.",Whacking Stick
Never Yield,"This creature always deals critical damage. At the start of this creature's turn, it Defends and then its turn ends.",Signet of Unity
Stand Alone Complex,"This creature always dodges attacks. At the start of this creature's turn, it Provokes and then its turn ends.",Peacebloom
Master of Aspects,"Your Aspects have another 50% independent chance to Dodge attacks. In addition, your Aspects take 25% less damage from all sources. This trait does not stack.",Sigil of the Aspect
Thirst For Blood,"After your creatures deal critical damage, they recover Health equal to 100% of the damage dealt. This trait does not stack.",Blooddrinker Tattoo
Ferocity,Your creatures always have Savage and have a 25% greater chance to deal critical damage. This trait does not stack.,Bonebreaker Tattoo
Marked With Blood,"After your other creatures deal critical damage with attacks, this creature Attacks the target.",Fleshstomper Tattoo
Sidewinder,"After this creature deals critical damage, it has a 75% chance to attack again.",Gutslasher Tattoo
Pummel,This creature deals 200% additional critical damage.,Heartripper Tattoo
Lacerate,"After your creatures deal critical damage, this creature afflicts the target with Silenced and Bleeding.",Strangler Tattoo
Quadhits,"When this creature Attacks, it Attacks a total of 4 times for 30% normal damage. It has a 10% chance to kill the target each time it deals critical damage.",Zantai Tattoo
Master of Asuras,Your Asuras' on-critical effects activate 2 additional times. This trait does not stack.,Sigil of the Asura
Momentum,"At the start of this creature's turn, it reduces the enemies' Speed by 15% of this creature's Speed.",Ancient Gear
Motivation,"At the start of this creature's turn, it reduces the enemies' Attack by 15% of this creature's Attack.",Arcane Gear
Euphoria,"At the start of this creature's turn, it reduces the enemies' Intelligence by 15% of this creature's Intelligence.",Cursed Gear
Instigation,"At the start of this creature's turn, it reduces the enemies' Defense by 15% of this creature's Defense.",Decrepit Gear
Pandemic,"At the start of this creature's turn, it afflicts enemies with a random debuff.",Luxury Gear
Battle From Within,"At the start of this creature's turn, it deals damage to enemies equal to 25% of its missing Health.",Siege Gear
Downturn,"At the start of this creature's turn, it removes 1 buff from each enemy.",War Gear
Master of Automatons,"If all the creatures in your party are Automatons, the strength of their innate traits is doubled. This trait does not stack.",Sigil of the Automaton
Periphery,"Your creatures always dodge attacks and deal critical damage, but take 50% more damage. This trait does not stack.",N/A
Trick Shot,"After this creature Attacks, it Casts 3 of its equipped Arrow spells.",N/A
Pandora,"Your creatures can equip all Spell Gems, regardless of their class. After your creatures manually Cast a spell, they also Cast a random spell from their Spell Gem list from each other class.",N/A
Wintermaul,"At the start of this creature's turn, it Casts Snowstorm. After your creatures Attack a Frozen enemy, they Cast Shatter on it. This trait does not stack.",N/A
The Nether,"At the start of your other creatures' turns, this creature performs an action depending on that creature's class. Chaos - Attack a random enemy. Death - Enemies are afflicted with a random debuff. Life - Your creatures gain a random buff. Nature - Your creatures gain 10% stats. Sorcery - Cast one of this creature's Spell Gems.",N/A
Avenged Sevenfold,"After your creatures take damage from an attack or spell, they Cast a Scourge spell on the enemy. The type of Scourge spell is based on the enemy's class. This trait does not stack.",N/A
The Black,"Enemies always have Poisoned, Blighted, Leeching, and Mending.",N/A
Eraser,"After your creatures Attack, they reduce the target's Maximum Health by the same amount of damage dealt. This trait does not stack.",N/A
Perfect Imperfection,"Your creatures deal 40% more damage and take 10% less damage for each turn they've taken in the current battle. At the start of battle, your creatures gain the Timewalk spell. This trait does not stack.",N/A
Marigold,Your creatures' stats gained in battle are no longer subject to diminishing returns.,N/A
Blood Pact,Your creatures deal additional damage equal to 5% of all the damage your creatures have dealt in the current battle. This trait does not stack.,N/A
Euthanasia,"After this creature damages an enemy below 50% Health, it Casts Death Siphon on it.",N/A
Brothel,"At the start of battle, your other creatures with the same class as this creature share their innate trait with the creatures adjacent to them. This trait does not stack.",N/A
Prayer Position,"At the end of your creatures' turns, they Defend. Your creatures take 90% less damage while they're Defending. This trait does not stack.",N/A
The End,"At the end of each enemy's turn, this creature deals damage to it equal to 40% of this creature's highest stat. This trait does not stack.",N/A
Lingering Essence,This creature takes 18% less damage for each of its living allies. This trait does not work if another creature has this trait.,N/A
I HATE YOU !@#$ING ALL,"AT THE END OF YOUR CREATURES' TURNS, THEY'LL SAY A LOT OF !@#$ED UP !@#$ TO THE ENEMIES. SINCE YOUR ENEMIES HAVE THE EMOTIONAL FORTITUDE OF A PIKACHU, THEY'LL CRY LIKE A BUNCH OF !@#$%ES AND DEAL 90% LESS DAMAGE. THIS TRAIT DOES NOT STACK, WHATEVER THE !@#$ THAT MEANS.",N/A
Soul Reaver,"After this creature damages an enemy, it steals their buffs and minions and gives them its debuffs. In addition, your creatures' buffs and minions last forever, and enemies' debuffs last forever.",N/A
Lune,"After your creatures Cast a spell, they also Cast a random, powerful spell. This trait does not stack.",N/A
Firelord,"When your creatures Attack, they deal 20% more damage for each time they've attacked in the current battle. This trait does not stack.",N/A
The Truth,"Your creatures' Artifacts' Nether Stones are 100% more powerful, and their Nether Stones' Spell Gems have a 100% chance to activate. This trait does not stack.",N/A
Expanded Power,Your creatures' damaging spells that have 'small' 'moderate' or 'large' potency now have 'massive' potency.,N/A
Empowered Death Siphon,"At the start of battle, this creature gains Death Siphon. When this creature Casts this spell, it doesn't kill the target.",Abyss Doll
Empowered Magic Missile,"At the start of battle, this creature gains Magic Missile. When this creature Casts this spell, it Casts 3 additional times.",Anguish Doll
Empowered Fireball,"At the start of battle, this creature gains Fireball. When this creature Casts this spell, it has a 75% chance to Cast it 1 additional time. This effect can occur repeatedly.",Destruction Doll
Empowered Bone Spear,"At the start of battle, this creature gains Bone Spear. When this creature Casts this spell, it Casts 1 additional time and ignores 25% of the target's Defense.",Impaler Doll
Tempest,Your creatures' single target spells have a 20% chance to also be Cast on all the target's allies. This trait does not stack.,Phobos Doll
Empowered Savage Spores,"At the start of battle, this creature gains Savage Spores. When this creature Casts this spell, it increases your creatures' Defense instead of decreasing it.",Savage Doll
Empowered Chain Lightning,"At the start of battle, this creature gains Chain Lightning. When this creature Casts this spell, its damage increases rather than decreases with each bounce.",Styx Doll
Empowered Death Blossom,"At the start of battle, this creature gains Death Blossom. When this creature Casts this spell, it deals a moderate amount of damage instead of a small amount of damage.",Tormented Doll
Empowered Soul Sacrifice,"At the start of battle, this creature gains Soul Sacrifice. When this creature Casts this spell, it also affects enemies.",Valentine Doll
Vlora's Haunting,"After this creature is moved to the top of the Timeline, your other creatures gain Invisible and Savage.",Vlora's Essence
Vlora's Lies,"After this creature is moved to the top of the Timeline, your other creatures gain a random minion.",Vlora's Poem
Vlora's Trick,"After this creature is moved to the top of the Timeline, enemies take damage equal to 50% of its highest stat.",Vlora's Flower
Master of Banshees,"If all the creatures in your party are Banshees, enemies always have Scorned.",Sigil of the Banshee
Song of Alacrity,Your creatures' attacks deal 50% of their damage using Speed instead of Attack. This trait does not stack.,Balladeer Harp
Christmas Music Sucks,The potency of your creatures' non-damaging spells is based on their Barrier absorption instead of intelligence.,Caroller Gift
Fable,"At the start of battle, this creature's race becomes Godspawn. Your creatures deal 25% more damage for each Godspawn creature fighting on your side. This trait does not stack.",Fool Harp
Song of Resolve,Your creatures' attacks deal 50% of their damage using Defense instead of Attack. This trait does not stack.,Jongleur Harp
Song of Wit,Your creatures' attacks deal 50% of their damage using Intelligence instead of Attack. This trait does not stack.,Minstrel Harp
Hymn of Guile,Enemies cannot gain Invisible.,Poet Harp
Hymn of Panic,"At the start of battle, the Timeline is shuffled randomly.",Trovatore Harp
Hymn of Strength,"When your creatures lose stats, the amount lost is reduced by 50%. This trait does not stack.",Versifier Harp
Master of Bards,"If all the creatures in your party are Bards, their Song traits are 100% more effective and they have an independent 50% chance to deal critical damage.
This trait does not stack.",Sigil of the Bard
Awakening,"If this creature does not take damage from attacks or spells between each of its turns, each of your creatures Cast one of their Spell Gems at random.",Crashing Husk
Here Until Forever,"If this creature does not take damage from attacks or spells between each of its turns, it recovers 100% Health and gains Rebirth.",Dormant Husk
Sluice,"If this creature does not take damage from attacks or spells between each of its turns, it Casts 3 of its Spell Gems at random.",Ethereal Husk
Run Free,"If this creature does not take damage from attacks or spells between each of its turns, it Attacks each enemy.",Lurking Husk
No Sudden Movement,"If this creature does not take damage from attacks or spells between each of its turns, it afflicts enemies with Snared and decreases their Speed by 30%.",Roaring Husk
Heated Ichor,"If this creature does not take damage from attacks or spells between each of its turns, it deals damage to enemies equal to 50% of its Current Health.",Spitting Husk
Sap,"If this creature does not take damage from attacks or spells between each of its turns, this creature Seals all the enemies' Spell Gems.",Stomping Husk
Master of Basilisks,"If all the creatures in your party are Basilisks, they have a 20% chance to avoid damage.
In addition, their innate traits have a 25% chance to activate even if they took damage between their turns. This trait does not stack.",Sigil of the Basilisk
Amongst Gods,"After an ally Attacks, this creature has a 20% chance to resurrect one of your creatures with 50% Health. This trait does not stack.",Angel Bat Wings
Bombardment,"After an ally Attacks, this creature deals damage to the target equal to 35% of its Attack.",Crypt Bat Wings
Dark Passenger,"After an ally Attacks, this creature has a 35% chance to Cast Necrosis.",Death Bat Wings
Cloud of Bats,"After an ally Attacks, this creature has a 50% chance to attack the same target.",Mutated Crypt Bat Wings
Screeching Barrage,"After an ally Attacks, this creature deals damage to enemies equal to 25% of its Speed.",Mutated Pulse Bat Wings
Vampiric Aura,"After an ally Attacks, your creatures recover Health equal to 25% of the damage dealt.",Mutated Vampire Bat Wings
Echolocation,"After an ally Attacks, this creature gains 7% Speed.",Pulse Bat Wings
Sluuurp!,"After an ally Attacks, this creature afflicts the enemy with a random debuff.",Slurping Bat Wings
Blood Sucker,"After an ally Attacks, this creature recovers Health equal to 100% of the damage dealt.",Vampire Bat Wings
Master of Bats,Your Bats have a 50% chance to Attack 1 additional time. This effect can occur repeatedly. This trait does not stack.,Sigil of the Bat
Overkill,"After this creature Attacks, and the damage exceeds 35% of the target's Maximum Health, enemies take 70% of this damage as well.",Blademaster Maul
Ultimatum,"After this creature Attacks, it deals damage to the target and enemies adjacent to the target equal to 50% of this creature's Current Health.",Brute Maul
Wallop,"After this creature Attacks, it decreases the Defense of the target and enemies adjacent to the target by 30%.",Captain Maul
Wrecking Ball,"After this creature Attacks, it afflicts the target with Vulnerable and Stone.",Enforcer Maul
