name,description,material_name
Star Prayer,Your creatures' 'Chance to Attack' Spell Gem properties have double the chance to activate. This trait does not stack.,Idol Antler
Touched By The Gods,Your creatures' 'Chance to Cast Twice' Spell Gem properties now activate 1 additional time.,Overseer Antler
Endlessly,Your creatures' Spell Gems gain 50% more benefit from their 'More Charges' properties. This trait does not stack.,Royal Antler
Like Sand,Your creatures' 'Cascading' spells now consume 2 additional Charges while they have over 50% of their total Charges. This trait does not stack.,Spirit Antler
Master of Stags,"If all the creatures in your party are Stags, their innate traits are 100% more effective. This trait does not stack.",Sigil of the Stag
Best Kind of Weather,"At the start of battle, your creatures gain Snowstorm. This spell deals 100% more damage.",Blizzard Gift
Storm to Pass,"While this creature is above 90% Health, enemies have a 20% chance to lose their turn at the start of their turn. This trait does not stack.",Cyclone Cloud
Powershift,"While this creature is above 90% Health, it deals 100% more damage.",Hurricane Cloud
Damage Control,"While this creature is above 90% Health, your creatures take 65% less damage. This trait does not stack.",Lord Cloud
Wasted Age,"While this creature is above 90% Health, it is immune to damage from spells.",Malignant Storm
Cloud Connected,"While this creature is above 90% Health, it has Repelling and Immune.",Raving Cloud
Sailor's Warning,"While this creature is above 90% Health, it has 50% more Attack, Intelligence, Defense, and Speed.",Red Cloud
Eye of the Storm,"While this creature is above 90% Health, your creatures' Health cannot fall below 5%. This effect is ignored if the incoming damage would exceed 100% of the creature's Maximum Health.",Thunder Cloud
Master of Storms,"If all the creatures in your party are Storms, their innate traits now activate while they're above 60% Health.",Sigil of the Storm
Monster Crown,"At the start of this creature's turn, it kills your other creatures and gains 20% of their stats.",Tanukrook Pact
And You Get A Bomb,"At the start of battle, this creature afflicts 3 random enemies with Bomb.",Bloodbather Poison
Not Quite A Dud,"When an enemy's Bomb detonates at the start of their turn, there is a 50% chance the Bomb debuff won't be removed from the creature. This trait does not stack.",Decoy Poison
Imminent Danger,"After your creatures attack an enemy with Bomb, the potency of the Bomb increases by 20%. This trait does not stack.",Infector Poison
"Click, Click, Boom!","After this creature defends or provokes, enemies take damage from their Bomb debuffs.",Mutant Poison
Sharing Is Caring,"After an enemy's Bomb detonates, adjacent enemies take 100% of the detonation damage as well. This trait does not stack.",Parasite Poison
A Gift For You,This creature's attacks deal 75% more damage and afflict the target with Bomb.,Slasher Poison
Spoonor's Breath,"At the start of this creature's turn, it increases the potency of enemies' Poisoned debuffs by 50%.",Spoonor's Spoon
Spoonor's Gift,"At the start of this creature's turn, it increases the potency of enemies' Bomb debuffs by 50%.",Spoonor's Spork
Spoonor's Other Breath,"At the start of this creature's turn, it increases the potency of enemies' Burning debuffs by 50%.",Spoonor's Fork
Master of Toxdwellers,Enemies' Bomb debuffs have an independent 50% chance to detonate 1 additional time for each Toxdweller in your party. This trait does not stack.,Sigil of the Toxdweller
Stomp,"When an enemy attacks, it has a 35% chance to be interrupted. This trait does not stack.",Ahnkol Soil
Constrict,"At the start of this creature's turn, it afflicts a random enemy with Snared and Feared.",Ahnok Soil
Solidarity,"At the start of battle, this creature Seals your creatures' first 2 Spell Gems and gains copies of them.",Gorlum Soil
Twilight,"At the end of this creature's turn, if it didn't cause any damage during its turn, it Attacks a random enemy for 200% normal damage.",Hanyac Soil
Jolt,"At the end of each enemy's turn, they are afflicted with Stone. This trait does not stack.",Quamar Soil
Rattle,"After an enemy Defends or Provokes, this creature Attacks it and afflicts it with Stone. This trait does not stack.",Quarnok Soil
Shake,"When an enemy Casts a spell, it has a 35% chance to be interrupted. This trait does not stack.",Urhul Soil
Master of Tremors,Your Tremors have 25% more Defense for each Tremor fighting on your side. This trait does not stack.,Sigil of the Tremor
Mystery Brew,"After this creature Provokes, it casts a random Booze Spell for each time (up to 5) it has Provoked in the current battle.",Alemaster Sweat
Resin,"At the start of this creature's turn, it deals damage to a random enemy equal to 75% of its Attack.",Arsonist Sweat
Misanthropy,"At the end of this creature's turn, it attacks two random enemies.",Berserker Sweat
Otherworld,Enemies take 20% more indirect damage. This trait does not stack.,
Year of the Trollboar,"After this creature Provokes, it deals damage to a random enemy equal to 25% of its Intelligence. This effect repeats once for every 5% Health this creature is missing.",Trollboar Lantern
Sadism,"At the start of this creature's turn, enemies take damage equal to 15% of their Current Health.",King Sweat
Fan of Knives,"After an ally Attacks, this creature deals damage to the target equal to 20% of its Speed.",Knife Juggler Sweat
Skull Bash,"At the end of this creature's turn, it has a 50% chance to send a random enemy to the bottom of the Timeline.",Necksnapper Sweat
Rude Awakening,"After an enemy is resurrected, this creature deals damage to it equal to 50% of the enemy's Current Health.",Youngster Sweat
Master of Trolls,Your Trolls have 25% more Attack and 10% less Intelligence for each Troll fighting on your side. This trait does not stack.,Sigil of the Troll
Dispossession,Your creatures take 50% less damage as a result of their class strength. This trait does not stack.,Dimensional Stardust
Mesmer,"After this creature damages an enemy, the enemy's class is changed to this creature's class weakness. This trait does not stack.",Demolisher Stardust
Capitalize,Your creatures deal 75% more damage as a result of their class strength. This trait does not stack.,Errant Stardust
Quantum Flux,"After your creatures take damage from an enemy, their class is changed to the enemy's class weakness. This trait does not stack.",Merciful Stardust
Bloodline,Your creatures always deal damage as if they are strong against their enemy's class. This trait does not stack.,Psychic Stardust
Details Matter,Your creatures always take damage as if they are strong against their enemy's class. This trait does not stack.,Sadist Stardust
Master of Unguideds,"If all the creatures in your party are Unguided, they deal 150% more damage to creatures that are weak against their class.",Sigil of the Unguided
Circle of Life,"After this creature Attacks, it heals allies for 50% of the damage dealt.",Consecrator Horseshoe
Eruption,"After this creature Attacks, it has a 50% chance to Cast Volcano.",Firewalker Horseshoe
Divine Mending,"After this creature Attacks, it heals its ally with the lowest health for 200% of the damage dealt.",Holycaster Horseshoe
Chrysaor's Ambition,"After this creature attacks, it gives a random ally 2 random buffs.",Pegasus Horseshoe
Righteous Winds,"After this creature Attacks, it increases a random ally's Attack and Intelligence by 50%.",Stormbringer Horseshoe
Spur of the Heavens,"After this creature Attacks, it has a 50% chance to move a random ally to the top of the Timeline.",Thundercracker Horseshoe
Reinvigoration,"After this creature Attacks, it resurrects a random ally with 50% Health.",Vivifier Horseshoe
Qila's Assurance,"After your creatures' Barrier buffs are destroyed, they gain Invisible.",Qila's Mane
Qila's Defiance,"While your creatures have Barrier, they are resistant to debuffs.",Qila's Wing
Qila's Safeguard,"While your creatures have Barrier, they take 40% less damage. This trait does not stack.",Qila's Horn
Master of Unicorns,Your Unicorns Attack 2 additional times. This trait does not stack.,Sigil of the Unicorns
Refraction,"After an enemy targets one of your creatures with a single-target spell, this creature Casts the same spell on the enemy.",Champion Rapier
Goad,Your creatures adjacent to this creature attack 2 additional times.,Duelist Rapier
Savior,This creature takes 50% of the damage in place of your other creatures from attacks and spells. This trait does not stack.,Knight Rapier
Thorns,"After your creatures are Attacked, they deal damage equal to 25% of their Attack to the enemy.",Lancer Rapier
Illumina,"After your creatures Attack, they have a 35% chance to gain a Barrier that absorbs damage equal to 50% of their Maximum Health. This trait does not stack.",Priestess Rapier
Sentinel,This creature and the creatures adjacent to this creature always have Taunting and Defensive.,Queen Rapier
Fight or Flight,"After your other creatures are Attacked by an enemy, this creature Attacks the enemy for 50% normal damage.",Scout Rapier
Second Wind,"After your creatures are Attacked, they recover Health equal to 25% of their Maximum Health.",Shieldmaiden Rapier
Master of Valkyries,"At the end of your Valkyries' turns, they Defend. This trait does not stack.",Sigil of the Valkryrie
Shadow Bulwark,"This creature always has Repelling, and takes 90% less indirect damage.",Angel Heart
Aether Eyes,Your creatures' Repelling buffs now have a 35% chance to ignore damage from attacks. This trait does not stack.,Devil Heart
Esoteric Alteration,Your creatures' Repelling buffs now have a 60% chance to prevent damage from spells. This trait does not stack.,Werewolf Heart
Contortion,"After your creatures with Repelling take damage from attacks or spells, they reflect 50% of the damage taken back on the enemy. This trait does not stack.",Imperial Heart
Return to Source,Your creatures' Repelling buffs now give them a 50% chance to avoid being afflicted by debuffs. This trait does not stack.,Subversive Heart
Mind Fortress,"After your creatures take damage from a spell, they gain Repelling.",Vampire Heart
Master of Voidlords,"If all the creatures in your party are Voidlords, they always have Repelling and take 30% less damage. This trait does not stack.",Sigil of the Voidlord
Impedance,"At the start of battle, this creature Seals one of each enemy's Spell Gems. This trait does not stack.",Cerebral Wind
Simulacrum,"When an enemy Casts a spell, this creature has a 35% chance to negate the spell. When this happens, this creature gains a copy of that Spell Gem. This trait does not stack.",Consuming Wind
Squall,"After an enemy is afflicted with a debuff, this creature Casts a random spell. This trait can only activate once per turn.",Evil Wind
Stifle,"After an enemy Casts a spell, this creature afflicts enemies with Silenced.",Mana Wind
Disturbance,"After an enemy manually Casts a spell, your creatures gain a copy of that Spell Gem.",Observer Wind
Ovular Barrage,"After this creature is Attacked, it Casts Verdant Spheres on the enemy.",Ovoid Egg
Mindbender,"When your creatures would take damage from spells, they have a 30% chance to ignore that damage. This trait does not stack.",Psychic Wind
Spiral Ward,This creature takes 2% less damage from spells (up to 90%) for every 1% Health it is missing.,Sulfuric Wind
Expansion,"After this creature takes damage, it gains Attack equal to 50% of the damage it took.",Untamed Wind
Master of Vortexes,"At the start of battle, your Vortexes gain the Spiral Ward trait. In addition, Spiral Ward now works with indirect damage as well.",Sigil of the Vortex
Metaphysics,Your creatures deal 75% more damage with spells that don't belong to their class. This trait does not stack.,Arcus Ear
Zerda,"Your creatures' first 3 non-Ethereal, healing Spell Gems each have a 20% chance to be Cast automatically at the start of battle. This trait does not stack.",Cosmos Ear
Corsac,"This creature's first 3 non-Ethereal, healing Spell Gems each have a 50% chance to be Cast automatically at the start of battle.",Decaying Ear
Naturalization,Your creatures take 4% less damage for each non-Ethereal Spell Gem they have. Maximum of 90% damage reduction. This trait does not stack.,Incandescent Ear
Lagopus,"Your creatures' first 3 non-Ethereal, stat-manipulating Spell Gems each have a 20% chance to be Cast automatically at the start of battle. This trait does not stack.",Lost Ear
Cana,"This creature's first 3 non-Ethereal, damaging Spell Gems each have a 50% chance to be Cast automatically at the start of battle.",Skyward Ear
Velox,"This creature's first 3 non-Ethereal, stat-manipulating Spell Gems each have a 50% chance to be Cast automatically at the start of battle.",Spirit Ear
Pallida,"Your creatures' first 3 non-Ethereal, damaging Spell Gems each have a 20% chance to be Cast automatically at the start of battle. This trait does not stack.",Terra Ear
Cyhra's Adamance,Your creatures deal 50% more damage for each time they've been resurrected in the current battle. This trait does not stack.,Cyhra's Adamance
Cyhra's Resilience,Your creatures take 15% less damage for each dead ally. This trait does not stack.,Cyhra's Broken Whiskers
Cyhra's Trust,Your creatures deal 25% more damage for each dead ally. This trait does not stack.,Cyhra's Severed Tail
Master of Vulpeses,"If all the creatures in your party are Vulpes, their innate traits now affect the first 5 non-Etheral Spell Gems they have equipped.",Sigil of the Vulpes
Endless Swarm,"After this creature Attacks, each of your dead Waspids have a 50% chance to be resurrected with 50% Health.",Guardian Stinger
Hive Mind,"After this creature Attacks, your other Waspids attack the same target for 30% normal damage. This trait does not affect other creatures with the same trait.",Hiveleader Stinger
Infiltration,Your Waspids have 20% more Speed for each Waspid fighting on your side. This trait does not stack.,Infiltrator Stinger
Swarm,Your Waspids each have a 4% chance to start at the top of the Timeline for each Waspid fighting on your side. This trait does not stack.,Scout Stinger
Gore,"After your Waspids attack, they afflict the target with Poisoned and Bleeding.",Slicer Stinger
Final Sting,"This creature deals 300% more damage with attacks. After this creature Attacks, it is killed.",Soldier Stinger
Disposability,Your other creatures' buffs persist through death.,Worker Stinger
Master of Waspids,"At the start of battle, your Waspids gain the Final Sting and Endless Swarm traits.",Sigil of the Waspid
Baffle,This creature deals extra damage equal to the amount of Intelligence it has greater than its target.,Coast Tears
Affluence,This creature deals 50% more damage for each non-Ethereal Sorcery Spell Gem it has greater than its target. Maximum of 300% bonus damage.,Glade Tears
Sycophant,This creature deals 125% more damage for each additional dead creature you have greater than the enemy.,Hell Tears
"Boing, Boing, Boing","After this creature is Attacked, it Attacks random enemies 3 times for 50% normal damage.",Inflatable Drink
Prowess,This creature deals 50% more damage for each Sorcery creature you have greater than the enemy.,Rift Tears
Gulper,"This creature deals 50% more damage for each buff, debuff, and minion it has greater than its target.",Roost Tears
Outnumbered,This creature deals 125% more damage for each additional living creature you have greater than your enemy.,Sentinel Tears
Subjugation,This creature deals extra damage equal to the amount of Defense it has greater than its target.,Sky Tears
Medierra's Mockery,"After an enemy Defends or Provokes, each of your creatures have a 50% chance to do so as well. This trait does not stack.",Medierra's Eyelid
Medierra's Reliance,"After an ally Attacks, Defends, or Provokes, this creature has a 30% chance to do so as well.",Medierra's Tendons
Medierra's Struggle,Your creatures take 1 extra turn if they're below 50% Health. This trait does not stack.,Medierra's Blood
Master of Watchers,Your Watchers' traits act as if they have 50% more of their requirement for each Watcher fighting on your side. This trait does not stack.,Sigil of the Watcher
Undeath,"After this creature dies, it has a 50% chance to resurrect with 100% Health.",Dread Rattle
Cold Like War,"After an enemy is resurrected, this creature Attacks it 2 times and afflicts it with Frozen.",Frostbite Rattle
Woe,"After this creature dies, enemies take damage equal to 30% of its Maximum Health.",Gravebane Rattle
No Head Necessary,"While this creature is dead, it has a 50% chance to attack enemies at the start of their turns.",Headless Pumpkin
Praise the Light,"After your creatures are resurrected, they Cast Holy Nova. This trait does not stack.",Holy Rattle
Resurrection Code,"After this creature dies, it has a 50% chance to resurrect all allies with 50% Health.",Reclusive Rattle
Afterlife,"After this creature dies for the first time in battle, it resurrects with 50% Health, and 50% more Attack, Intelligence, Defense, and Speed.",Roofstalker Rattle
Dark Embrace,"After your creatures die, this creature gains 25% of their Attack, Intelligence, Defense, and Speed.",Terror Rattle
Last Stand,"After this creature dies, it attacks random enemies 5 times.",Trepidation Rattle
Shackler's Domination,Your Shades share their innate traits with each other.,Shackler's Chains
Shackler's Mastery,Your creatures' race-specific traits act as if your party contains 2 more creatures that belong to that race. This trait does not stack.,Shackler's Signet
Shackler's Trance,"This creature always deals 0 damage during its turn, but deals 200% more damage when it is not its turn.",Shackler's Cape
Master of Wights,Your Wights always resurrect with 100% Health and Shelled.,Sigil of the Wight
Lyra,"This creature Attacks and Casts spells 3 additional times. After this creature takes damage, it is sent to the bottom of the Timeline.",Abyssal Phylactery
Overpowered,"This creature deals 100% more damage. After this creature takes damage, it is sent to the bottom of the Timeline.",Dancing Phylactery
Ethereal,"This creature is immune to debuffs and takes 50% less damage. After this creature takes damage, it is sent to the bottom of the Timeline.",Laughing Phylactery
Poof!,"This creature always deals critical damage and has an independent 90% chance to dodge attacks. After this creature takes damage, it is sent to the bottom of the Timeline.",Scheming Phylactery
The Virtue of Patience,"At the start of this creature's turn, your creatures gain 3 random buffs. After this creature takes damage, it is sent to the bottom of the Timeline.",Seer Phylactery
Spasm,"At the start of this creature's turn, it Casts its first five non-Ethereal Spell Gems. After this creature takes damage, it is sent to the bottom of the Timeline.",Watcher Phylactery
Master of Wisps,"If all the creatures in your party are Wisps, they have a 25% chance to avoid damage and gain Shelled at the start of their turns. This trait does not stack.",Sigil of the Wisp
Ditto,"After one of your creatures manually Casts a Scourge spell, this creature Casts the same Scourge spell.",Docile Carrot
Soul Sucker,"After your creatures Cast a damaging spell, they recover Health equal to 30% of the damage dealt. This trait does not stack.",Vampiric Carrot
Camaraderie,"After this creature Defends, it gains a Barrier that absorbs damage equal to 100% of its Maximum Health. If this creature already has a Barrier, it gives it to a random ally instead.",Gummy Egg
Colorblind,"After this creature Attacks, it Casts a Scourge spell that matches the target's class.",Vicious Carrot
Fraud,Your creatures' Scourge spells no longer consume Charges and cannot be Sealed.,Vile Carrot
Echoing Incantation,This creatures' single-target spells have a 35% chance to be Cast 1 additional time. This effect can occur repeatedly.,Villous Carrot
Bottom Feeder,Your creatures' Scourge spells also afflict the target with a debuff that is based on the type of Scourge spell that is Cast. This trait does not stack.,Viridian Carrot
Prey,"At the start of battle, your creatures gain a Scourge spell that matches their class. This trait does not stack.",Volatile Carrot
Whimsical,Your creatures' Scourge spells deal 100% more damage. This trait does not stack.,Volcanic Carrot
Furness' Decadence,Your creature can Cast Booze Spells without consuming Charges.,Broken Bottle
Furness' Instability,"At the start of this creature's turn, it Casts one of its non-Ethereal Booze Spell spells.",Pills
Furness' Stupor,This creature's Booze Spells are 100% more potent.,Dried Vomit
Master of Wolpertingers,"If all the creatures in your party are Wolpertingers, their Scourge spells always deal critical damage and have a 50% chance to be cast 1 additional time.
This effect can occur multiple times in a row. This trait does not stack.",Sigil of the Wolpertinger
Wings of Despair,"When an enemy would gain a buff, this creature has a 50% chance to gain it instead.",Airslayer Head
Fallen Star,"When an enemy would gain stats, this creature has a 50% chance to gain them instead.",Daybreaker Head
Deep Inhalation,"After an enemy Casts a spell on all your creatures, this creature has a 50% chance to Cast the spell on the enemy creatures as well. This trait does not stack.",Skystalker Head
Bounce,"After an enemy Casts a single-target spell on one of your creatures, this creature has a 50% chance to Cast the spell on a random enemy. This trait does not stack.",Sonicscreecher Head
Currents,"After an enemy gains stats, this creature afflicts it with a random debuff.",Toxicfang Head
Spell Stealer,"After an enemy Casts a spell on all its allies, this creature has a 50% chance to Cast the same spell on your creatures as well. This trait does not stack.",Windrider Head
Master of Wyverns,Your Wyverns take 80% less damage from spells. This trait does not stack.,Sigil of the Wyvern
Winter Has Come,"At the start of battle, this creature afflicts 2 random enemies with Frozen.",Ancient Snowball
Thermal Void,Enemies take 50% more damage while they are Frozen. This trait does not stack.,Chillbreeze Snowball
Ice Nova,"After this creature Provokes, each enemy has a 50% chance to be afflicted with Frozen.",Coldslam Snowball
Brain Freeze,"After this creature is Attacked, the enemy is afflicted with Frozen.",Frostbite Snowball
Lingering Frost,"After an enemy's Frozen debuff expires, this creature afflicts it with Snared.",Icemane Snowball
Frost Breath,"After this creature dodges or deals critical damage, each enemy has a 50% chance to be afflicted with Frozen.",Rimefist Snowball
Cold Snap,"When this creature damages a Frozen enemy, it deals 300% more damage and removes the debuff.",Snowsting Snowball
Vext's Antiquity,"When enemies lose stats, increase the amount of stats reduced by 50%. This trait does not stack.",Vext's Fingers
Vext's Boldness,Increases your creature's maximum stat limit before they are subjected to diminishing returns by 50%. This trait does not stack.,Vext's Eyebrows
Vext's Invocation,"When your creatures gain stats, increase the amount of stats gained by 50%. This trait does not stack.",Vext's Toes
Master of Yetis,"At the start of battle, enemies are afflicted with Frozen if all the creatures in your party are Yetis.",Sigil of the Yeti
Zantai's Boon,"At the start of battle, this creature gains Mega Magic. Your creatures' Mega Magic now grants your creatures 3 random buffs.",Jewel of Zantai (Purple)
Zantai's Call,"At the start of battle, this creature gains Mega Magic. Your creatures' Mega Magic now grants your creatures 3 random minions.",Jewel of Zantai (Red)
Zantai's Cunning,"At the start of battle, this creature gains Mega Magic. Your creatures' Mega Magic ignores 15% of the enemies' Defense.",Jewel of Zantai (White)
Zantai's Embrace,"At the start of battle, this creature gains Mega Magic. Your creatures' Mega Magic now heals your creatures equal to 100% of the damage dealt.",Jewel of Zantai (Cyan)
Zantai's Envy,"At the start of battle, this creature gains Mega Magic. Your creatures' Mega Magic now afflicts enemies with 3 random debuffs.",Jewel of Zantai (Orange)
Zantai's Havoc,"At the start of battle, this creature gains Mega Magic. Your creatures' Mega Magic now deals a devastating amount of damage.",Jewel of Zantai (Blue)
Zantai's Inhibition,"At the start of battle, this creature gains Mega Magic. Your creatures' Mega Magic now decreases enemies' stats equal to 25% of the damage dealt.",Jewel of Zantai (Green)
Zantai's Perfection,"At the start of battle, this creature gains Mega Magic. Your creatures' Mega Magic has 3 extra Charges.",Jewel of Zantai (Yellow)
Zantai's Stratagem,"At the start of battle, this creature gains Mega Magic. The damage of your creatures' Mega Magic is now based on their highest stat.",Jewel of Zantai (Teal)
Zantai's Reign,"At the start of battle, this creature gains Mega Magic. Your creatures' Mega Magic now increases your creatures' stats equal to 5% of the damage dealt.",Jewel of Zantai (Magenta)
Abyss Orbs,"If an enemy has taken at least 2 turns, they are afflicted with a random debuff at the start and end of their turn. This trait does not stack.",Dark Stick
Adaptive Tactics,Your creatures' attacks ignore 5% of the enemies' Defense (up to 50%) for each time a creature died in the current battle. This trait does not stack.,Weapon Kit
Alchemist's Buffer,This creature takes 50% less damage from spells and 50% more damage from attacks. This creature has 50% more Intelligence and 50% less Attack.,Corruptium
Anatidaephobia,All creatures' attacks make a quacking sound.,Rubber Ducky
Anointed,"After this creature Attacks, it gains 20% Speed.",Prismatic Feather
